{
  "$schema": "http://json-schema.org/draft-07/schema#",
  "title": "Perfil de innovacion",
  "type": "array",
  "items": {
    "type": "object",
    "properties": {
      "IDENTIFICADOR_UJ": { "type": "string" },
      "PerfilExpresdeInnovacion": { "type": "boolean" },
      "PerfilAvanzadoDeInnovacion": { "type": "boolean" },
      "FechaUltimoPerfilExprex": { "type": "string", "format": "date" },
      "ResultadoGlobalDelPerfilExpres": { "type": "number", "minimum": 0, "maximum": 100 },
      "ResultadosCapacidadesPerfilExpres": { "type": "number", "minimum": 0 },
      "ResultadosActividadPerfilExpres": { "type": "number", "minimum": 0 },
      "FechaUltimoPerfilAvanzado": { "type": "string", "format": "date" },
      "ResultadoGlobalDelPerfilAvanzado": { "type": "number", "minimum": 0, "maximum": 100 },
      "ResultadoCapacidadesPerfilAvanzado": { "type": "number", "minimum": 0 },
      "ResultadoInnovacionProductoPerfilAvanzado": { "type": "number", "minimum": 0 },
      "ResultadoInnovacionProcesoPerfilAvanzado": { "type": "number", "minimum": 0 },
      "ResultadosInnovacionPersonasPerfilAvanzado": { "type": "number", "minimum": 0 },
      "ResultadosInnovacionMercadoPerfilAvanzado": { "type": "number", "minimum": 0 }
    },
    "required": [ "IDENTIFICADOR_UJ","PerfilExpresdeInnovacion", "PerfilAvanzadoDeInnovacion" ],
    "allOf": [
      {
        "if": {
          "properties": { "PerfilExpresdeInnovacion": { "const": true } }
        },
        "then": {
          "properties": {
            "FechaUltimoPerfilExprex": { "type": "string", "format": "date" },
            "ResultadoGlobalDelPerfilExpres": { "type": "number", "minimum": 0, "maximum": 100 },
            "ResultadosCapacidadesPerfilExpres": { "type": "number", "minimum": 0 },
            "ResultadosActividadPerfilExpres": { "type": "number", "minimum": 0 }
          },
          "required": ["FechaUltimoPerfilExprex", "ResultadoGlobalDelPerfilExpres", 
          "ResultadosCapacidadesPerfilExpres", "ResultadosActividadPerfilExpres"]
        },
        "else": {
          "not": {
            "anyOf": [
              { "required": ["FechaUltimoPerfilExprex"] },
              { "required": ["ResultadoGlobalDelPerfilExpres"] },
              { "required": ["ResultadosCapacidadesPerfilExpres"] },
              { "required": ["ResultadosActividadPerfilExpres"] }
            ]
          }
        }
      },
      {
        "if": {
          "properties": { "PerfilAvanzadoDeInnovacion": { "const": true } }
        },
        "then": {
          "properties": {
            "FechaUltimoPerfilAvanzado": { "type": "string", "format": "date" },
            "ResultadoGlobalDelPerfilAvanzado": { "type": "number", "minimum": 0, "maximum": 100 },
            "ResultadoCapacidadesPerfilAvanzado": { "type": "number", "minimum": 0 },
            "ResultadoInnovacionProductoPerfilAvanzado": { "type": "number", "minimum": 0 },
            "ResultadoInnovacionProcesoPerfilAvanzado": { "type": "number", "minimum": 0 },
            "ResultadosInnovacionPersonasPerfilAvanzado": { "type": "number", "minimum": 0 },
            "ResultadosInnovacionMercadoPerfilAvanzado": { "type": "number", "minimum": 0 }
          },
          "required": ["FechaUltimoPerfilAvanzado", "ResultadoGlobalDelPerfilAvanzado", "ResultadoCapacidadesPerfilAvanzado",
        "ResultadoInnovacionProductoPerfilAvanzado",  "ResultadoInnovacionProcesoPerfilAvanzado", 
        "ResultadosInnovacionPersonasPerfilAvanzado", "ResultadosInnovacionMercadoPerfilAvanzado"]
        },
        "else": {
          "not": {
            "anyOf": [
              { "required": ["FechaUltimoPerfilAvanzado"] },
              { "required": ["ResultadoGlobalDelPerfilAvanzado"] },
              { "required": ["ResultadoCapacidadesPerfilAvanzado"] },
              { "required": ["ResultadoInnovacionProductoPerfilAvanzado"] },
              { "required": ["ResultadoInnovacionProcesoPerfilAvanzado"] },
              { "required": ["ResultadosInnovacionPersonasPerfilAvanzado"] },
              { "required": ["ResultadosInnovacionMercadoPerfilAvanzado"] }
            ]
          }
        }
      }
    ],
    "additionalProperties": false
  }
}
